{
  "$schema": "https://arval.vantezzen.io/schemas/agcs.schema.json",
  "version": 1,
  "name": "Utility Fl채chenbeschr채nkungen",
  "scope": "global",

  "rules": [
    {
      "action": "forbid",
      "subject": "area",
      "appliesToTags": ["plant", "furniture"],

      "reason": "Unter dieser Fl채che befinden sich Versorgungsleitungen, die nicht blockiert werden d체rfen.",
      "reasonType": "full",

      "area": {
        "type": "polygon",
        "coordinates": [
          [5, 0],
          [5, 10],
          [6, 10],
          [6, 0],
          [5, 0]
        ]
      }
    },

    {
      "action": "forbid",
      "subject": "area",
      "appliesToTags": ["plant", "furniture"],

      "reason": "An dieser Stelle findet Samstags der Wochenmarkt statt.",
      "reasonType": "full",

      "area": {
        "type": "polygon",
        "coordinates": [
          [0, -5],
          [0, -10],
          [5, -10],
          [5, -5],
          [0, -5]
        ]
      }
    }
  ]
}
